{
  "version": "1.0",
  "authority": "SKILL.md",
  "boundary": "git-tracked-knowledge-base",
  "trackedFileCount": 142,
  "packageFileCount": 142,
  "retrievalFileCount": 24,
  "entries": [
    {
      "id": "ztde-kb-6e1a355561a3a767",
      "path": "knowledge-base/INDEX.md",
      "sha256": "d50b0498e31b73428b685811b49579671deb325ee075c6147dd985fa4da5989e",
      "purpose": "knowledge-governance",
      "retrievalStatus": "excluded",
      "packageStatus": "included",
      "publicStatus": "admitted",
      "provenanceRecord": "maintained-core",
      "sourceRecord": "ztothez-maintained",
      "sourceOrigin": "original",
      "declaredOwner": "ZtotheZ",
      "licenseOrPermissionBasis": "ISC",
      "reuseBasis": "Approved for distribution as part of ZtotheZ Design Engineering.",
      "transformationStatus": "independently-authored",
      "transformation": "Independently authored and maintained from project requirements, owner evidence, and publicly identified standards without copied reference-product implementation.",
      "reviewedBy": "ZtotheZ",
      "reviewedAt": "2026-08-26T00:00:00+03:00",
      "classification": {
        "duplicate": false,
        "superseded": false,
        "generation": "maintained-authored",
        "personalData": "none-declared",
        "externalSource": false
      },
      "disposition": "admit"
    },
    {
      "id": "ztde-kb-6eae66a0644321c7",
      "path": "knowledge-base/benchmarks/aegisops/CALIBRATION.md",
      "sha256": "ad56595f21c555b20dea73c2696ef34737c033980721c94829a9060173ebd200",
      "purpose": "product-benchmark",
      "retrievalStatus": "excluded",
      "packageStatus": "included",
      "publicStatus": "admitted",
      "provenanceRecord": "aegisops-benchmark",
      "sourceRecord": "aegisops-owner-evidence",
      "sourceOrigin": "user-owned",
      "declaredOwner": "ZtotheZ",
      "licenseOrPermissionBasis": "owner-authorized benchmark use",
      "reuseBasis": "Approved benchmark contract, summaries, journeys, and evidence templates.",
      "transformationStatus": "owner-evidence-normalized",
      "transformation": "Owner-authorized product behavior was normalized into project contracts, bounded evidence summaries, journeys, anti-patterns, and review records.",
      "reviewedBy": "ZtotheZ",
      "reviewedAt": "2026-08-26T00:00:00+03:00",
      "classification": {
        "duplicate": false,
        "superseded": false,
        "generation": "maintained-authored",
        "personalData": "none-declared",
        "externalSource": false
      },
      "disposition": "admit"
    },
    {
      "id": "ztde-kb-3791d9c0f8900bea",
      "path": "knowledge-base/benchmarks/aegisops/MANIFEST.md",
      "sha256": "74db4b07832a3906081a6b506691d264139e783d15c2fd387c6fc9e8446ede5b",
      "purpose": "product-benchmark",
      "retrievalStatus": "excluded",
      "packageStatus": "included",
      "publicStatus": "admitted",
      "provenanceRecord": "aegisops-benchmark",
      "sourceRecord": "aegisops-owner-evidence",
      "sourceOrigin": "user-owned",
      "declaredOwner": "ZtotheZ",
      "licenseOrPermissionBasis": "owner-authorized benchmark use",
      "reuseBasis": "Approved benchmark contract, summaries, journeys, and evidence templates.",
      "transformationStatus": "owner-evidence-normalized",
      "transformation": "Owner-authorized product behavior was normalized into project contracts, bounded evidence summaries, journeys, anti-patterns, and review records.",
      "reviewedBy": "ZtotheZ",
      "reviewedAt": "2026-08-26T00:00:00+03:00",
      "classification": {
        "duplicate": false,
        "superseded": false,
        "generation": "maintained-authored",
        "personalData": "none-declared",
        "externalSource": false
      },
      "disposition": "admit"
    },
    {
      "id": "ztde-kb-286f0f978558ace3",
      "path": "knowledge-base/benchmarks/aegisops/SOURCE-EVIDENCE.md",
      "sha256": "f2c4244f803036a5577ce2ee280337718a1af1bbab90114e30582a97be51e190",
      "purpose": "product-benchmark",
      "retrievalStatus": "excluded",
      "packageStatus": "included",
      "publicStatus": "admitted",
      "provenanceRecord": "aegisops-benchmark",
      "sourceRecord": "aegisops-owner-evidence",
      "sourceOrigin": "user-owned",
      "declaredOwner": "ZtotheZ",
      "licenseOrPermissionBasis": "owner-authorized benchmark use",
      "reuseBasis": "Approved benchmark contract, summaries, journeys, and evidence templates.",
      "transformationStatus": "owner-evidence-normalized",
      "transformation": "Owner-authorized product behavior was normalized into project contracts, bounded evidence summaries, journeys, anti-patterns, and review records.",
      "reviewedBy": "ZtotheZ",
      "reviewedAt": "2026-08-26T00:00:00+03:00",
      "classification": {
        "duplicate": false,
        "superseded": false,
        "generation": "maintained-authored",
        "personalData": "none-declared",
        "externalSource": false
      },
      "disposition": "admit"
    },
    {
      "id": "ztde-kb-13f62e95a70252bb",
      "path": "knowledge-base/benchmarks/aegisops/acceptance-criteria.md",
      "sha256": "e73830fe47d027e5907b842b891727597ae4fa91c9d79f3a45aca5afd6c87b16",
      "purpose": "product-benchmark",
      "retrievalStatus": "excluded",
      "packageStatus": "included",
      "publicStatus": "admitted",
      "provenanceRecord": "aegisops-benchmark",
      "sourceRecord": "aegisops-owner-evidence",
      "sourceOrigin": "user-owned",
      "declaredOwner": "ZtotheZ",
      "licenseOrPermissionBasis": "owner-authorized benchmark use",
      "reuseBasis": "Approved benchmark contract, summaries, journeys, and evidence templates.",
      "transformationStatus": "owner-evidence-normalized",
      "transformation": "Owner-authorized product behavior was normalized into project contracts, bounded evidence summaries, journeys, anti-patterns, and review records.",
      "reviewedBy": "ZtotheZ",
      "reviewedAt": "2026-08-26T00:00:00+03:00",
      "classification": {
        "duplicate": false,
        "superseded": false,
        "generation": "maintained-authored",
        "personalData": "none-declared",
        "externalSource": false
      },
      "disposition": "admit"
    },
    {
      "id": "ztde-kb-bfdc0b2c1db8a2c6",
      "path": "knowledge-base/benchmarks/aegisops/anti-patterns.md",
      "sha256": "9afab3490228a51c63376b5cfca8a479c8fe59cf6adba8218fe5f891e6e85d42",
      "purpose": "product-benchmark",
      "retrievalStatus": "excluded",
      "packageStatus": "included",
      "publicStatus": "admitted",
      "provenanceRecord": "aegisops-benchmark",
      "sourceRecord": "aegisops-owner-evidence",
      "sourceOrigin": "user-owned",
      "declaredOwner": "ZtotheZ",
      "licenseOrPermissionBasis": "owner-authorized benchmark use",
      "reuseBasis": "Approved benchmark contract, summaries, journeys, and evidence templates.",
      "transformationStatus": "owner-evidence-normalized",
      "transformation": "Owner-authorized product behavior was normalized into project contracts, bounded evidence summaries, journeys, anti-patterns, and review records.",
      "reviewedBy": "ZtotheZ",
      "reviewedAt": "2026-08-26T00:00:00+03:00",
      "classification": {
        "duplicate": false,
        "superseded": false,
        "generation": "maintained-authored",
        "personalData": "none-declared",
        "externalSource": false
      },
      "disposition": "admit"
    },
    {
      "id": "ztde-kb-2289afe5dcc09672",
      "path": "knowledge-base/benchmarks/aegisops/attestations.template.yaml",
      "sha256": "efc01a2ce3bc595bf41bcef30072f9bac9fba48a41842206fde84bc63b1bf97c",
      "purpose": "product-benchmark",
      "retrievalStatus": "excluded",
      "packageStatus": "included",
      "publicStatus": "admitted",
      "provenanceRecord": "aegisops-benchmark",
      "sourceRecord": "aegisops-owner-evidence",
      "sourceOrigin": "user-owned",
      "declaredOwner": "ZtotheZ",
      "licenseOrPermissionBasis": "owner-authorized benchmark use",
      "reuseBasis": "Approved benchmark contract, summaries, journeys, and evidence templates.",
      "transformationStatus": "owner-evidence-normalized",
      "transformation": "Owner-authorized product behavior was normalized into project contracts, bounded evidence summaries, journeys, anti-patterns, and review records.",
      "reviewedBy": "ZtotheZ",
      "reviewedAt": "2026-08-26T00:00:00+03:00",
      "classification": {
        "duplicate": false,
        "superseded": false,
        "generation": "maintained-authored",
        "personalData": "none-declared",
        "externalSource": false
      },
      "disposition": "admit"
    },
    {
      "id": "ztde-kb-6b395e620af440f4",
      "path": "knowledge-base/benchmarks/aegisops/attestations.yaml",
      "sha256": "033975edac7e41b2fc88eae73411980c762ebb68b091cd7fe723ae0a0e75a517",
      "purpose": "product-benchmark",
      "retrievalStatus": "excluded",
      "packageStatus": "included",
      "publicStatus": "admitted",
      "provenanceRecord": "aegisops-benchmark",
      "sourceRecord": "aegisops-owner-evidence",
      "sourceOrigin": "user-owned",
      "declaredOwner": "ZtotheZ",
      "licenseOrPermissionBasis": "owner-authorized benchmark use",
      "reuseBasis": "Approved benchmark contract, summaries, journeys, and evidence templates.",
      "transformationStatus": "owner-evidence-normalized",
      "transformation": "Owner-authorized product behavior was normalized into project contracts, bounded evidence summaries, journeys, anti-patterns, and review records.",
      "reviewedBy": "ZtotheZ",
      "reviewedAt": "2026-08-26T00:00:00+03:00",
      "classification": {
        "duplicate": false,
        "superseded": false,
        "generation": "maintained-authored",
        "personalData": "owner-attribution",
        "externalSource": false
      },